{
  "id": "abyssal-current",
  "name": "ABYSSAL-CURRENT",
  "definition": "ABYSSAL-CURRENT is the Adic-Bound Yoneda Semantic Syntax Activating Locally-Coherent Unions of Relational Ribosomes Engaging Neural-Node Topology.\nThe SEA has MUD and FOAM in the ABYSSAL-CURRENT.",
  "x-provenance": {
    "recorded-by": "content-librarian",
    "recorded-on": "2026-07-30"
  }
}
