{
  "id": "ecology",
  "name": "ECOLOGY",
  "definition": "ECOLOGY is Excitation of Colonies Organizing Language Ontology Game Yield.\nAn ECOLOGY is the relationship in which SEA has MUD and FOAM, and GLASS-SPONGE lives on MUD in symbiosis with SHRIMP.",
  "x-provenance": {
    "recorded-by": "content-librarian",
    "recorded-on": "2026-07-30"
  }
}
