{
  "id": "live",
  "name": "LIVE",
  "definition": "LIVE is Localize Independent Vector Emissions.\nMIAOTANG GLASS-SPONGE LIVE on MUD and MOVE and GROW with JIANGHU SHRIMP who PLAY in SWARMs in the FOAM WHIRLING in the ABYSSAL-CURRENT of the SEA.",
  "x-provenance": {
    "recorded-by": "content-librarian",
    "recorded-on": "2026-07-30"
  }
}
