{
  "id": "miaotang",
  "name": "MIAOTANG",
  "definition": "MIAOTANG is Mimetic Interactive Actors Organizing Traces of Articulated Neural Games.\nMIAOTANG GLASS-SPONGE LIVE on MUD and MOVE and GROW with JIANGHU SHRIMP who PLAY in SWARMs in the FOAM WHIRLING in the ABYSSAL-CURRENT of the SEA.",
  "x-provenance": {
    "recorded-by": "content-librarian",
    "recorded-on": "2026-07-30",
    "note": "spelling normalized from Leader message typo Artciulated"
  }
}
