{
  "id": "glass-sponge",
  "name": "GLASS-SPONGE",
  "definition": "GLASS-SPONGE is Genet-Language Actuators Simulating Sentient Semiotic Pores Operating Nutrient-Game Exchange.\nGLASS-SPONGE lives on MUD in symbiosis with SHRIMP.",
  "x-provenance": {
    "recorded-by": "content-librarian",
    "recorded-on": "2026-07-30"
  }
}
